{"schema_version":"1","analysis_rev":"fx-0001","producer_commit":"w0-fixture","input_artifact_hashes":{},"cell_m":0.5,"nx":32,"ny":20,"origin":[-8.0,-5.0],"cam_bit_order":["ceiling_00","ceiling_04","eye_00"],"row_major":true,"encoding":"u8_cell_cam","states":{"0":"unknown","1":"visible","2":"occluded","3":"out_of_fov","4":"no_video"},"t0_s":0,"per_sec":["AwEDAwEDAwEDAwEDAwEDAwEDAwEDAQEDAQEDAQEDAQEDAQEDAQEBAQEBAQEBAQEBAQEBAwIBAwIBAwIBAwIBAwIBAwIBAwIBAwIBAwIBAwMBAwMBAwMBAwMBAwMBAwMCAwEDAwEDAwEDAwEDAwEDAwEDAQEDAQEDAQEDAQEDAQEDAQEBAQEBAQEBAQEBAQEBAQEBAQEBAQIBAQIBAQIBAwIBAwIBAwIBAwIBAwIBAwMBAwMBAwMCAwMCAwMCAwMCAwEDAwEDAwEDAwEDAwEDAQEDAQEDAQEDAQEDAQEDAQEDAQEBAQEBAQEBAQEBAQEBAQEBAQEBAQEBAQIBAQIBAQIBAQIBAQIBAQIBAwIBAwICAwMCAwMCAwMCAwMCAwMCAwEDAwEDAwEDAwEDAQEDAQEDAQEDAQEDAQEDAQEDAQEBAQEBAQEBAQEBAQEBAQEBAQEBAQEBAQEBAQEBAQIBAQIBAQIBAQIBAQICAQICAQICAQECAwMCAwMCAwMCAwMCAwEDAwEDAwEDAQEDAQEDAQEDAQEDAQEDAQEDAQEBAQEBAQEBAQEBAQEBAQEBAQEBAQEBAQEBAQEBAQEBAQEBAQIBAQIBAgICAgICAgICAgICAgICAwECAwMCAwMCAwMCAwEDAwEDAQEDAQEDAQEDAQEDAQEDAQEDAQEBAQEBAQEBAQEBAQEBAQEBAQEBAQEBAQEBAQEBAQEBAQEBAQEBAQEBAQIBAgICAgICAgICAgICAgICAwECAwECAwMBAwMBAwEDAwEDAQEDAQEDAQEDAQEDAQEDAQEBAQEBAQEBAQEBAQEBAQEBAQEBAQEBAQEBAQEBAQEBAQEBAQEBAQEBAQEBAQEBAgEBAgEBAgEBAgEBAgEBAgEBAwEBAwMBAwMBAwEDAQEDAQEDAQEDAQIDAQIDAQIDAQIBAQIBAQIBAQIBAQIBAQIBAQIBAQEBAQEBAQEBAQEBAQEBAQEBAQEBAQEBAQEBAgEBAgEBAgEBAgEBAgEBAgEBAwMBAwMBAwMBAQEDAQEDAQEDAQEDAQIDAQIDAQIDAQIBAQIBAQIBAQIBAQIBAQIBAQIBAQIBAQIBAQEBAQEBAQEBAQEBAQEBAQEBAQEBAgEBAgEBAgEBAgEBAgEBAgEBAwMBAwMBAwMBAQEDAQEDAQEDAQEDAQIDAQIDAQIDAQIBAQIBAQIBAQIBAQIBAQIBAQIBAQIBAQIBAQIBAQIBAQEBAQEBAQEBAQEBAQEBAgEBAgEBAgEBAgEBAgEBAgMCAwMCAwMCAwMCAQEDAQEDAQEDAQEDAQEDAQEDAQEDAQIDAQIBAQIBAQIBAQIBAQIBAQIBAQIBAQIBAQIBAQIBAQIBAQIBAQECAQECAQECAgECAgECAgECAgECAgECAgMCAgMCAwMCAwMCAQEDAQEDAQEDAQEDAQEDAQEDAQEDAQEDAQEBAQEBAQIBAQIBAQIBAQIBAQIBAgICAgICAgICAgICAgICAgICAQECAQECAgECAgECAgECAgECAgECAgMCAgMCAwMCAwMCAQEDAQEDAQEDAQEDAQEDAQEDAQEDAQEDAQEBAQEBAQEBAQEBAQEBAQEBAQIBAgICAgICAgICAgICAgICAgICAQECAQECAQECAgECAgECAgECAgMCAgMCAgMCAwMCAwMCAQEDAQEDAQEDAQEDAQEDAQEDAQEDAQEDAQEBAQEBAQEBAQEBAQEBAQEBAgEBAgEBAgEBAgEBAgEBAgEBAgEBAQEBAQEBAQEBAgEBAgEBAgEBAgMBAgMBAgMBAwMBAwMBAQEDAQEDAQEDAQEDAQEDAQEDAQEDAQEDAQEBAQEBAQEBAQEBAQEBAQEBAgEBAgEBAgEBAgEBAgEBAgEBAgEBAQEBAQEBAQEBAQEBAQEBAQMBAQMBAQMBAQMBAQMBAwMBAQEDAQEDAQEDAQEDAQEDAQEDAQEDAQEDAQEDAQEBAQEBAQEBAQEBAQEBAgEBAgEBAgEBAgEBAgEBAgEBAgEBAQEBAQEBAQEBAQEBAQEBAQMBAQMBAQMBAQMBAQMBAwMBAQEDAQEDAQEDAQEDAQEDAQEDAQEDAQEDAQEDAQEBAQEBAQEBAQEBAgEBAgEBAgEBAgEBAgEBAgEBAgEBAgEBAQEBAQEBAQEBAQEBAQMBAQMBAQMBAQMBAQMBAQMBAwMBAQEDAQEDAQEDAQEDAQEDAQEDAQEDAQEDAQEDAQEDAQEDAQEBAQEBAgEBAgEBAgEBAgEBAgEBAgEBAgEBAgEBAQEBAQEBAQEBAQEBAQMBAQMBAQMBAQMBAQMBAQMBAwMBAQEDAQEDAQEDAQEDAQEDAQEDAQEDAQEDAQEDAQEDAQEDAQEDAQEDAgEBAgEBAgEBAgEBAgEBAgEBAgEBAgEBAQEBAQEBAQEBAQEBAQMBAQMBAQMBAQMBAQMBAQMBAQMBAQEDAQEDAQEDAQEDAQEDAQEDAQEDAQEDAQEDAQEDAQEDAQEDAgEDAgEDAgEDAgEDAgEBAgEBAgEBAgEBAgEBAQEBAQEBAQEBAQMBAQMBAQMBAQMBAQMBAQMBAQMBAQMB","AwEDAwEDAwEDAwEDAwEDAwEDAwEDAQEDAQEDAQEDAQEDAQEDAQEBAQEBAQEBAQIBAQIBAwIBAwIBAwIBAwIBAwIBAwIBAwIBAwEBAwEBAwMBAwMBAwMCAwMCAwMCAwMCAwEDAwEDAwEDAwEDAwEDAwEDAQEDAQEDAQEDAQEDAQEDAQEBAQEBAQEBAQEBAQEBAQIBAQIBAQIBAQIBAQIBAwIBAwIBAwIBAwIBAwEBAwMCAwMCAwMCAwMCAwMCAwMCAwEDAwEDAwEDAwEDAwEDAQEDAQEDAQEDAQEDAQEDAQEDAQEBAQEBAQEBAQEBAQEBAQEBAQIBAQIBAQIBAQIBAQIBAQIBAQIBAQICAwECAwECAwMCAwMCAwMCAwMCAwMCAwEDAwEDAwEDAwEDAQEDAQEDAQEDAQEDAQEDAQEDAQEBAQEBAQEBAQEBAQEBAQEBAQEBAQEBAQIBAQIBAQIBAQIBAQICAQICAQICAQICAQECAQECAwMCAwMCAwMCAwMCAwEDAwEDAwEDAQEDAQEDAQEDAQEDAQEDAQEDAQEBAQEBAQEBAQEBAQEBAQEBAQEBAQEBAQEBAQEBAQIBAQIBAgICAgICAgICAgICAgICAQECAQECAwECAwMCAwMCAwMCAwEDAwEDAQEDAQEDAQEDAQEDAQEDAQEDAQEBAQEBAQEBAQEBAQEBAQEBAQEBAQEBAQEBAQEBAQEBAQEBAQIBAgICAgICAgICAgICAgICAgECAQECAwECAwEBAwMBAwMBAwEDAwEDAQEDAQEDAQEDAQEDAQEDAQEBAQEBAQEBAQEBAQEBAQEBAQEBAQEBAQEBAQEBAQEBAQEBAQEBAQEBAgEBAgEBAgEBAgEBAgEBAgEBAQEBAQEBAwEBAwMBAwMBAwEDAQEDAQEDAQEDAQIDAQIDAQIDAQIBAQIBAQIBAQIBAQIBAQIBAQIBAQEBAQEBAQEBAQEBAQEBAQEBAQEBAgEBAgEBAgEBAgEBAgEBAgEBAgEBAQEBAwMBAwMBAwMBAQEDAQEDAQEDAQEDAQIDAQIDAQIDAQIBAQIBAQIBAQIBAQIBAQIBAQIBAQIBAQIBAQEBAQEBAQEBAQEBAQEBAgEBAgEBAgEBAgEBAgEBAgEBAgEBAQEBAwMBAwMBAwMBAQEDAQEDAQEDAQEDAQIDAQIDAQIDAQIBAQIBAQIBAQIBAQIBAQIBAQIBAQIBAQIBAQIBAQIBAQEBAQEBAQEBAgEBAgEBAgEBAgEBAgEBAgEBAgEBAQMCAwMCAwMCAwMCAQEDAQEDAQEDAQEDAQEDAQEDAQEDAQIDAQIBAQIBAQIBAQIBAQIBAQIBAQIBAQIBAQIBAQIBAQIBAQIBAQECAgECAgECAgECAgECAgECAgECAgECAgMCAQMCAwMCAwMCAQEDAQEDAQEDAQEDAQEDAQEDAQEDAQEDAQEBAQEBAQIBAQIBAQIBAQIBAQIBAgICAgICAgICAgICAgICAgICAgECAgECAgECAgECAgECAgECAgECAgMCAQMCAwMCAwMCAQEDAQEDAQEDAQEDAQEDAQEDAQEDAQEDAQEBAQEBAQEBAQEBAQEBAQEBAQIBAgICAgICAgICAgICAgICAgICAgECAgECAgECAgECAgECAgECAgMCAgMCAQMCAwMCAwMCAQEDAQEDAQEDAQEDAQEDAQEDAQEDAQEDAQEBAQEBAQEBAQEBAQEBAQEBAgEBAgEBAgEBAgEBAgEBAgEBAgEBAgEBAgEBAgEBAgEBAgEBAgEBAgMBAgMBAQMBAwMBAwMBAQEDAQEDAQEDAQEDAQEDAQEDAQEDAQEDAQEBAQEBAQEBAQEBAQEBAQEBAgEBAgEBAgEBAgEBAgEBAgEBAgEBAQEBAQEBAQEBAQEBAQEBAQMBAQMBAQMBAQMBAQMBAwMBAQEDAQEDAQEDAQEDAQEDAQEDAQEDAQEDAQEDAQEBAQEBAQEBAQEBAQEBAgEBAgEBAgEBAgEBAgEBAgEBAgEBAQEBAQEBAQEBAQEBAQEBAQMBAQMBAQMBAQMBAQMBAwMBAQEDAQEDAQEDAQEDAQEDAQEDAQEDAQEDAQEDAQEBAQEBAQEBAQEBAgEBAgEBAgEBAgEBAgEBAgEBAgEBAgEBAQEBAQEBAQEBAQEBAQMBAQMBAQMBAQMBAQMBAQMBAwMBAQEDAQEDAQEDAQEDAQEDAQEDAQEDAQEDAQEDAQEDAQEDAQEBAQEBAgEBAgEBAgEBAgEBAgEBAgEBAgEBAgEBAQEBAQEBAQEBAQEBAQMBAQMBAQMBAQMBAQMBAQMBAwMBAQEDAQEDAQEDAQEDAQEDAQEDAQEDAQEDAQEDAQEDAQEDAQEDAQEDAgEBAgEBAgEBAgEBAgEBAgEBAgEBAgEBAQEBAQEBAQEBAQEBAQMBAQMBAQMBAQMBAQMBAQMBAQMBAQEDAQEDAQEDAQEDAQEDAQEDAQEDAQEDAQEDAQEDAQEDAQEDAgEDAgEDAgEDAgEDAgEBAgEBAgEBAgEBAgEBAQEBAQEBAQEBAQMBAQMBAQMBAQMBAQMBAQMBAQMBAQMB","AwEDAwEDAwEDAwEDAwEDAwEDAwEDAQEDAQEDAQEDAQEDAQEDAQEBAQIBAQIBAQIBAQIBAwIBAwIBAwIBAwIBAwIBAwEBAwEBAwEBAwEBAwMCAwMCAwMCAwMCAwMCAwMCAwEDAwEDAwEDAwEDAwEDAwEDAQEDAQEDAQEDAQEDAQEDAQEBAQEBAQEBAQIBAQIBAQIBAQIBAQIBAQIBAQIBAwIBAwIBAwEBAwECAwECAwMCAwMCAwMCAwMCAwMCAwMCAwEDAwEDAwEDAwEDAwEDAQEDAQEDAQEDAQEDAQEDAQEDAQEBAQEBAQEBAQEBAQIBAQIBAQIBAQIBAQIBAQIBAQIBAQICAQICAQECAwECAwECAwMCAwMCAwMCAwMCAwMCAwEDAwEDAwEDAwEDAQEDAQEDAQEDAQEDAQEDAQEDAQEBAQEBAQEBAQEBAQEBAQEBAQIBAQIBAQIBAQIBAQICAQICAQICAQICAQECAQECAQECAQECAwMCAwMCAwMCAwMCAwEDAwEDAwEDAQEDAQEDAQEDAQEDAQEDAQEDAQEBAQEBAQEBAQEBAQEBAQEBAQEBAQEBAQEBAQIBAQIBAgICAgICAgICAgICAgECAQECAQECAQECAwECAwMCAwMBAwMBAwEDAwEDAQEDAQEDAQEDAQEDAQEDAQEDAQEBAQEBAQEBAQEBAQEBAQEBAQEBAQEBAQEBAQEBAQEBAgIBAgICAgICAgICAgICAgECAQECAQECAQEBAwEBAwEBAwMBAwMBAwEDAwEDAQEDAQEDAQEDAQEDAQEDAQEBAQEBAQEBAQEBAQEBAQEBAQEBAQEBAQEBAQEBAQEBAQEBAgEBAgEBAgEBAgEBAgEBAgEBAQEBAQEBAQEBAQEBAwEBAwMBAwMBAwEDAQEDAQEDAQEDAQIDAQIDAQIDAQIBAQIBAQIBAQIBAQIBAQIBAQIBAQEBAQEBAQEBAQEBAQEBAgEBAgEBAgEBAgEBAgEBAgEBAQEBAQEBAQEBAQEBAwMBAwMBAwMBAQEDAQEDAQEDAQEDAQIDAQIDAQIDAQIBAQIBAQIBAQIBAQIBAQIBAQIBAQIBAQIBAQEBAQEBAQEBAgEBAgEBAgEBAgEBAgEBAgEBAgEBAQEBAQEBAQEBAwMBAwMBAwMBAQEDAQEDAQEDAQEDAQIDAQIDAQIDAQIBAQIBAQIBAQIBAQIBAQIBAQIBAQIBAQIBAQIBAQIBAQEBAgEBAgEBAgEBAgEBAgEBAgEBAgEBAQEBAQEBAQMCAwMCAwMCAwMCAQEDAQEDAQEDAQEDAQEDAQEDAQEDAQIDAQIBAQIBAQIBAQIBAQIBAQIBAQIBAQIBAQIBAQIBAQIBAgIBAgECAgECAgECAgECAgECAgECAQECAQECAQMCAQMCAwMCAwMCAQEDAQEDAQEDAQEDAQEDAQEDAQEDAQEDAQEBAQEBAQIBAQIBAQIBAQIBAQIBAgICAgICAgICAgICAgICAgICAgECAgECAgECAgECAgECAQECAQECAQMCAQMCAwMCAwMCAQEDAQEDAQEDAQEDAQEDAQEDAQEDAQEDAQEBAQEBAQEBAQEBAQEBAQEBAQIBAgICAgICAgICAgICAgICAgICAgECAgECAgECAgECAgECAQECAQMCAQMCAQMCAwMCAwMCAQEDAQEDAQEDAQEDAQEDAQEDAQEDAQEDAQEBAQEBAQEBAQEBAQEBAQEBAgEBAgEBAgEBAgEBAgEBAgEBAgEBAgEBAgEBAgEBAgEBAgEBAQEBAQMBAQMBAQMBAwMBAwMBAQEDAQEDAQEDAQEDAQEDAQEDAQEDAQEDAQEBAQEBAQEBAQEBAQEBAQEBAgEBAgEBAgEBAgEBAgEBAgEBAgEBAQEBAQEBAQEBAQEBAQEBAQMBAQMBAQMBAQMBAQMBAwMBAQEDAQEDAQEDAQEDAQEDAQEDAQEDAQEDAQEDAQEBAQEBAQEBAQEBAQEBAgEBAgEBAgEBAgEBAgEBAgEBAgEBAQEBAQEBAQEBAQEBAQEBAQMBAQMBAQMBAQMBAQMBAwMBAQEDAQEDAQEDAQEDAQEDAQEDAQEDAQEDAQEDAQEBAQEBAQEBAQEBAgEBAgEBAgEBAgEBAgEBAgEBAgEBAgEBAQEBAQEBAQEBAQEBAQMBAQMBAQMBAQMBAQMBAQMBAwMBAQEDAQEDAQEDAQEDAQEDAQEDAQEDAQEDAQEDAQEDAQEDAQEBAQEBAgEBAgEBAgEBAgEBAgEBAgEBAgEBAgEBAQEBAQEBAQEBAQEBAQMBAQMBAQMBAQMBAQMBAQMBAwMBAQEDAQEDAQEDAQEDAQEDAQEDAQEDAQEDAQEDAQEDAQEDAQEDAQEDAgEBAgEBAgEBAgEBAgEBAgEBAgEBAgEBAQEBAQEBAQEBAQEBAQMBAQMBAQMBAQMBAQMBAQMBAQMBAQEDAQEDAQEDAQEDAQEDAQEDAQEDAQEDAQEDAQEDAQEDAQEDAgEDAgEDAgEDAgEDAgEBAgEBAgEBAgEBAgEBAQEBAQEBAQEBAQMBAQMBAQMBAQMBAQMBAQMBAQMBAQMB","AwEDAwEDAwEDAwEDAwEDAwEDAwEDAQEDAQEDAQEDAQIDAQIDAQIBAQIBAQIBAQIBAQIBAwIBAwIBAwIBAwEBAwEBAwEBAwEBAwECAwECAwMCAwMCAwMCAwMCAwMCAwMCAwEDAwEDAwEDAwEDAwEDAwEDAQEDAQEDAQEDAQEDAQEDAQEBAQIBAQIBAQIBAQIBAQIBAQIBAQIBAQIBAQIBAwEBAwECAwECAwECAwECAwMCAwMCAwMCAwMCAwMCAwMCAwEDAwEDAwEDAwEDAwEDAQEDAQEDAQEDAQEDAQEDAQEDAQEBAQEBAQIBAQIBAQIBAQIBAQIBAQIBAQIBAQICAQICAQECAQECAQECAwECAwECAwMCAwMCAwMCAwMCAwMCAwEDAwEDAwEDAwEDAQEDAQEDAQEDAQEDAQEDAQEDAQEBAQEBAQEBAQEBAQIBAQIBAQIBAQIBAQIBAQICAQICAQICAQICAQECAQECAQECAQECAQECAwMCAwMCAwMCAwMBAwEDAwEDAwEDAQEDAQEDAQEDAQEDAQEDAQEDAQEBAQEBAQEBAQEBAQEBAQEBAQEBAQIBAQIBAgICAgICAgICAgICAgICAQECAQECAQECAQECAQECAwEBAwMBAwMBAwMBAwEDAwEDAQEDAQEDAQEDAQEDAQEDAQEDAQEBAQEBAQEBAQEBAQEBAQEBAQEBAQEBAQEBAQIBAgICAgICAgICAgICAgICAQECAQECAQEBAQEBAQEBAwEBAwEBAwMBAwMBAwEDAwEDAQEDAQEDAQEDAQEDAQEDAQEBAQEBAQEBAQEBAQEBAQEBAQEBAQEBAQEBAQEBAgEBAgEBAgEBAgEBAgEBAgEBAQEBAQEBAQEBAQEBAQEBAQEBAwEBAwMBAwMBAwEDAQEDAQEDAQEDAQIDAQIDAQIDAQIBAQIBAQIBAQIBAQIBAQIBAQIBAQEBAQEBAQEBAgEBAgEBAgEBAgEBAgEBAgEBAQEBAQEBAQEBAQEBAQEBAQEBAwMBAwMBAwMBAQEDAQEDAQEDAQEDAQIDAQIDAQIDAQIBAQIBAQIBAQIBAQIBAQIBAQIBAQIBAQIBAQEBAgEBAgEBAgEBAgEBAgEBAgEBAgEBAQEBAQEBAQEBAQEBAQEBAwMBAwMBAwMBAQEDAQEDAQEDAQEDAQIDAQIDAQIDAQIBAQIBAQIBAQIBAQIBAQIBAQIBAQIBAQIBAQIBAgIBAgEBAgEBAgEBAgEBAgEBAgEBAQEBAQEBAQEBAQEBAQMCAwMCAwMCAwMCAQEDAQEDAQEDAQEDAQEDAQEDAQEDAQIDAQIBAQIBAQIBAQIBAQIBAQIBAQIBAQIBAgIBAgIBAgIBAgIBAgECAgECAgECAgECAQECAQECAQECAQECAQMCAQMCAwMCAwMCAQEDAQEDAQEDAQEDAQEDAQEDAQEDAQEDAQEBAQEBAQIBAQIBAQIBAQIBAQIBAgICAgICAgICAgICAgICAgICAgECAgECAgECAQECAQECAQECAQECAQMCAQMCAwMCAwMCAQEDAQEDAQEDAQEDAQEDAQEDAQEDAQEDAQEBAQEBAQEBAQEBAQEBAQEBAQIBAgICAgICAgICAgICAgICAgICAgECAgECAgECAQECAQECAQECAQMCAQMCAQMCAwMCAwMCAQEDAQEDAQEDAQEDAQEDAQEDAQEDAQEDAQEBAQEBAQEBAQEBAQEBAQEBAgEBAgEBAgEBAgEBAgEBAgEBAgEBAgEBAgEBAgEBAQEBAQEBAQEBAQMBAQMBAQMBAwMBAwMBAQEDAQEDAQEDAQEDAQEDAQEDAQEDAQEDAQEBAQEBAQEBAQEBAQEBAQEBAgEBAgEBAgEBAgEBAgEBAgEBAgEBAQEBAQEBAQEBAQEBAQEBAQMBAQMBAQMBAQMBAQMBAwMBAQEDAQEDAQEDAQEDAQEDAQEDAQEDAQEDAQ